page_ptr_id,date,body,main_image_id,featured,image_carousel,body_de,body_en,body_es,search_description_de,search_description_en,search_description_es,seo_title_de,seo_title_en,seo_title_es,slug_de,slug_en,slug_es,title_de,title_en,title_es,url_path_de,url_path_en,url_path_es,main_image_caption,main_image_caption_de,main_image_caption_en,main_image_caption_es,gefoerdert_durch_img_id,active,urls
217,2016-05-12,"In Kooperation mit der Professional School of Education (PSE) und dem dort angesiedelten HUmanities Lab werden am Interdisziplinären Labor praktische Module für Schülerinnen und Schüler entwickelt.In diesem Rahmen arbeitet seit Anfang 2016 das Projekt »Anthropozän-Küche« an der didaktischen Aufarbeitung des Wissenschaftscomics »Die Anthropozän-Küche. Matooke, Bienenstich und eine Prise Phosphor - in zehn Speisen um die Welt«, welcher sich mit globalen Stoffflüssen rund um das Thema Ernährung auseinandersetzt.  Die Arbeit umfasst die Entwicklung einer Lehrerhandreichung sowie deren begleitete Anwendung an Berliner Schulen. Das HUmanities Lab ermöglicht das Projekt durch entsprechende didaktische Expertise und die Finanzierung einer studentischen Mitarbeiterin.Das Programm ist im Aufbau begriffen und die Zusammenarbeit mit weiteren Forschungsprojekten am Cluster in Planung.https://www.hu-berlin.de/de/foerdern/was/projekte/nachwuchs/humanities-lab   ",673,f,[],"In Kooperation mit der Professional School of Education (PSE) und dem dort angesiedelten HUmanities Lab werden am Interdisziplinären Labor praktische Module für Schülerinnen und Schüler entwickelt.In diesem Rahmen arbeitet seit Anfang 2016 das Projekt »Anthropozän-Küche« an der didaktischen Aufarbeitung des Wissenschaftscomics »Die Anthropozän-Küche. Matooke, Bienenstich und eine Prise Phosphor - in zehn Speisen um die Welt«, welcher sich mit globalen Stoffflüssen rund um das Thema Ernährung auseinandersetzt.  Die Arbeit umfasst die Entwicklung einer Lehrerhandreichung sowie deren begleitete Anwendung an Berliner Schulen. Das HUmanities Lab ermöglicht das Projekt durch entsprechende didaktische Expertise und die Finanzierung einer studentischen Mitarbeiterin.Das Programm ist im Aufbau begriffen und die Zusammenarbeit mit weiteren Forschungsprojekten am Cluster in Planung.https://www.hu-berlin.de/de/foerdern/was/projekte/nachwuchs/humanities-lab   ",,,,,,,,,schuler_innenlabor,,,Schüler_innenlabor,,,/home/schuler_innenlabor/,,,,,,,950,1,"https://www.hu-berlin.de/de/foerdern/was/projekte/nachwuchs/humanities-lab https://www.hu-berlin.de/de/foerdern/was/projekte/nachwuchs/humanities-lab https://www.hu-berlin.de/de/foerdern/was/projekte/nachwuchs/humanities-lab https://www.hu-berlin.de/de/foerdern/was/projekte/nachwuchs/humanities-lab https://www.hu-berlin.de/de/foerdern/was/projekte/nachwuchs/humanities-lab https://www.hu-berlin.de/de/foerdern/was/projekte/nachwuchs/humanities-lab https://www.hu-berlin.de/de/foerdern/was/projekte/nachwuchs/humanities-lab https://www.hu-berlin.de/de/foerdern/was/projekte/nachwuchs/humanities-lab"
1354,2016-02-17,"Das Interdisziplinäre Labor ist Kooperationspartner des 1-jährigen Masterstudiengangs »COOP Design Research«, der an der Hochschule Anhalt in Zusammenarbeit mit der Stiftung Bauhaus Dessau ab Herbst 2014 gestartet ist. Das Studienprogramm teilt sich in die drei Schwerpunkte »Design as research«, Design as education«, »Design as projection« und stützt sich auf die Disziplinen Architektur, Design, Kulturwissenschaft, Bildwissenschaft, Materialwissenschaft und der Geschichte und Theorie des Design und Architektur. www.coopdesignresearch.de",1068,f,[],"Das Interdisziplinäre Labor ist Kooperationspartner des 1-jährigen Masterstudiengangs »COOP Design Research«, der an der Hochschule Anhalt in Zusammenarbeit mit der Stiftung Bauhaus Dessau ab Herbst 2014 gestartet ist. Das Studienprogramm teilt sich in die drei Schwerpunkte »Design as research«, Design as education«, »Design as projection« und stützt sich auf die Disziplinen Architektur, Design, Kulturwissenschaft, Bildwissenschaft, Materialwissenschaft und der Geschichte und Theorie des Design und Architektur. www.coopdesignresearch.de","The Interdisciplinary Lab is cooperating with Anhalt University of Applied Sciences and Bauhaus Dessau Foundation in conducting the one-year MSc. program on Design Research at Gropius´ Bauhaus in Dessau.It is conceived as a preparatory step towards a doctoral study. It strives to integrate design and research, which are often perceived as separate disciplines.The core of the MSc. Programme, communicated using different teaching methods with the participation of the three aforementioned partner institutions, relies on three thematic building blocks: Design as research – analysis of the synthesising practices; design as projection – anticipation and intervention strategies; design in the world – impact and application. The participants gain sound scientific knowledge and competencies on the basis of tasks that are both practice-orientated and forward-looking. For further information, please have a look at www.coopdesignresearch.de",,,,,,,,masterstudiengang-coop-design-research,,,"Masterstudiengang »Coop Design Research«",,,/home/masterstudiengang-coop-design-research/,,,,,,,,1,"http://www.coopdesignresearch.de/ http://www.coopdesignresearch.de/ http://www.coopdesignresearch.de/ http://www.coopdesignresearch.de/ http://www.coopdesignresearch.de/ http://www.coopdesignresearch.de/"
1355,2016-03-01,"Das Hermann von Helmholtz-Zentrum kooperiert mit dem interdisziplinären Studienprogramm »Vielfalt der Wissensformen«. Im Sommersemester 2016 liegt der Schwerpunkt auf »Raum/Topos«. Die Gastprofessorin Prof. Dr. Alexandra von Stosch bietet in diesem Themenfeld eine Vorlesung, drei Seminare sowie einen Workshop an. In ihrer Vorlesung zum Spannungsfeld der Utopie untersucht sie die historische und gegenwärtige Wirkungsmacht von Zukunftsbildern und -orten für die Gestaltung der Wirklichkeit. Ihre Seminare reichen thematisch von der Auseinandersetzung mit virtuellen Räumen über die Erforschung historischer Schichten im Stadtraum bis hin zum Museum als Wissensfigur und Stifter kultureller Identität.Auch das Interdisziplinäre Labor kooperiert mit dem Studienprogramm »Vielfalt der Wissensformen«. Das Seminar »Curating Knowledge« wird von Mitarbeiter_innen des Clusters im Co-Teaching angeboten.Prof. Dr. Sharon Macdonald, Dr. Nikola Doll, Dr. Sabine Moller, Gundula Avenarius und Frauke Stuhl I Seminar, DO 10-14, MO 40/41, R. 408Weitere Informationen &#38;gt;&#38;gt;",811,f,[],"Das Hermann von Helmholtz-Zentrum kooperiert mit dem interdisziplinären Studienprogramm »Vielfalt der Wissensformen«. Im Sommersemester 2016 liegt der Schwerpunkt auf »Raum/Topos«. Die Gastprofessorin Prof. Dr. Alexandra von Stosch bietet in diesem Themenfeld eine Vorlesung, drei Seminare sowie einen Workshop an. In ihrer Vorlesung zum Spannungsfeld der Utopie untersucht sie die historische und gegenwärtige Wirkungsmacht von Zukunftsbildern und -orten für die Gestaltung der Wirklichkeit. Ihre Seminare reichen thematisch von der Auseinandersetzung mit virtuellen Räumen über die Erforschung historischer Schichten im Stadtraum bis hin zum Museum als Wissensfigur und Stifter kultureller Identität.Auch das Interdisziplinäre Labor kooperiert mit dem Studienprogramm »Vielfalt der Wissensformen«. Das Seminar »Curating Knowledge« wird von Mitarbeiter_innen des Clusters im Co-Teaching angeboten.Prof. Dr. Sharon Macdonald, Dr. Nikola Doll, Dr. Sabine Moller, Gundula Avenarius und Frauke Stuhl I Seminar, DO 10-14, MO 40/41, R. 408Weitere Informationen &#38;gt;&#38;gt;",,,,,,,,,im-irrgarten-des-wissens-lehrveranstaltungen-mit-vielfalt-der-wissensformen_2,,,"Interdisziplinäres Studienprogramm »Vielfalt der Wissensformen«",,,/home/im-irrgarten-des-wissens-lehrveranstaltungen-mit-vielfalt-der-wissensformen_2/,,,,,,,,1,"https://www.hu-berlin.de/de/einrichtungen-organisation/verwaltung/bolognalab/projekte-des-bologna.labs/vielfalt-der-wissensformen/vielfalt-der-wissensformen https://www.hu-berlin.de/de/einrichtungen-organisation/verwaltung/bolognalab/projekte-des-bologna.labs/vielfalt-der-wissensformen/vielfalt-der-wissensformen https://www.hu-berlin.de/de/einrichtungen-organisation/verwaltung/bolognalab/projekte-des-bologna.labs/vielfalt-der-wissensformen/vielfalt-der-wissensformen https://www.hu-berlin.de/de/einrichtungen-organisation/verwaltung/bolognalab/projekte-des-bologna.labs/vielfalt-der-wissensformen/vielfalt-der-wissensformen"
103,2016-06-08,"Das  Promotionsprogramm »Bild Wissen Gestaltung« begegnet der Herausforderung, eine disziplinäre Promotion mit der gemeinsamen Forschung in einer interdisziplinären Arbeitsgruppe zu verbinden und verfolgt das Ziel, in diesem Rahmen hervorragende Promotionen zu ermöglichen. Die Promovierenden qualifizieren sich durch ihre Teilnahme für eine weitere berufliche Laufbahn im Abschlussfach und erwerben konkrete interdisziplinäre Kompetenzen innerhalb des Programmzeitraumes von 36 Monaten. Das Qualifikationsprogramm setzt sich aus vier Modulen zusammen, innerhalb derer während der Promotionsphase insgesamt 180 Credit Points (1 CP = 30 h) erworben werden. Um der Vielfalt der Forschungsthemen und disziplinären Hintergründe seiner Mitglieder gerecht zu werden, ist kein einheitliches Curriculum vorgesehen, vielmehr werden die Programminhalte nach den Zielen des Kompetenzerwerbs strukturiert: Die Module geben Qualifikationsziele vor, die dafür zu erbringenden Leistungen und Aktivitäten werden für jeden Teilnehmenden individuell festgelegt.Das Betreuungskonzept legt die Betreuung jeder Promotion durch ein Team aus mindestens zwei Betreuer_innen unterschiedlicher disziplinärer Expertise fest. Den Promotionsvorhaben soll so von Beginn an sowohl disziplinäre Fachkompetenz wie auch Methoden- und Perspektivenvielfalt anderer Fachbereiche zu Seite gestellt werden.Das Programm ist Mitglied  der Humboldt Graduate School (HGS). Diese wirkt als Qualitätssicherungs- und Evaluationsinstanz und übernimmt fachübergreifende Dienstleistungen und nicht-fachliche Soft-Skill Trainings sowie Mentoring. Die vollständige Programmordnung kann hier heruntergeladen werden: Strukturiertes Promotionsprogramm »Bild Wissen Gestaltung«Koordination:Franziska WegenerE-Mail: bwg.promotionsprogramm@hu-berlin.de ",675,f,[],"Das  Promotionsprogramm »Bild Wissen Gestaltung« begegnet der Herausforderung, eine disziplinäre Promotion mit der gemeinsamen Forschung in einer interdisziplinären Arbeitsgruppe zu verbinden und verfolgt das Ziel, in diesem Rahmen hervorragende Promotionen zu ermöglichen. Die Promovierenden qualifizieren sich durch ihre Teilnahme für eine weitere berufliche Laufbahn im Abschlussfach und erwerben konkrete interdisziplinäre Kompetenzen innerhalb des Programmzeitraumes von 36 Monaten. Das Qualifikationsprogramm setzt sich aus vier Modulen zusammen, innerhalb derer während der Promotionsphase insgesamt 180 Credit Points (1 CP = 30 h) erworben werden. Um der Vielfalt der Forschungsthemen und disziplinären Hintergründe seiner Mitglieder gerecht zu werden, ist kein einheitliches Curriculum vorgesehen, vielmehr werden die Programminhalte nach den Zielen des Kompetenzerwerbs strukturiert: Die Module geben Qualifikationsziele vor, die dafür zu erbringenden Leistungen und Aktivitäten werden für jeden Teilnehmenden individuell festgelegt.Das Betreuungskonzept legt die Betreuung jeder Promotion durch ein Team aus mindestens zwei Betreuer_innen unterschiedlicher disziplinärer Expertise fest. Den Promotionsvorhaben soll so von Beginn an sowohl disziplinäre Fachkompetenz wie auch Methoden- und Perspektivenvielfalt anderer Fachbereiche zu Seite gestellt werden.Das Programm ist Mitglied  der Humboldt Graduate School (HGS). Diese wirkt als Qualitätssicherungs- und Evaluationsinstanz und übernimmt fachübergreifende Dienstleistungen und nicht-fachliche Soft-Skill Trainings sowie Mentoring. Die vollständige Programmordnung kann hier heruntergeladen werden: Strukturiertes Promotionsprogramm »Bild Wissen Gestaltung«Koordination:Franziska WegenerE-Mail: bwg.promotionsprogramm@hu-berlin.de ","The Doctoral Program »Image Knowledge Gestaltung« answers the challenge of consolidating the pursuit of a doctoral degree in a primary discipline with conducting collaborative research in an interdisciplinary working group. The program aims to enable doctoral candidates to successfully carry out outstanding work within this framework.Within the program duration of 36 months, participating doctoral candidates obtain the professional qualifications for a career in their primary discipline in addition to gaining specific interdisciplinary skills. The qualification program consist of four modules in which students must obtain a total of 180 Credit Points (1 CP = 30 hrs) during their candidacy. Instead of a uniform curriculum, the program’s content is tailored to suit the candidate’s individual competence areas, thus adapting to a varying range of research subjects and interdisciplinary backgrounds. Each module corresponds to a qualification area, where performance and activity requirements to complete modules are assigned to program participants individually.The program’s doctoral supervision concept entails a team of at least two experts from different disciplines per student. The progress of each project is thus accompanied by the supervision of experts in each candidate’s primary discipline, in addition to benefiting from a variety of methods and perspectives from other disciplines.As a member of the Humboldt Graduate School (HGS), the program’s quality standards are under the supervision and evaluation of the Humboldt University’s umbrella organization for graduate students, which additionally offers a wide range of services and soft skill training, as well as mentoring programs.The complete doctoral program regulations are available for download here: Structured Doctoral Program »Image Knowledge Gestaltung«.","El programa de promoción, el cual esta abierto a todos los miembros del Cluster, esta acreditado por la Humboldt Graduate School (HGS). EL HGS actúa como instancia evaluadora  y control de calidad y esta a cargo de la administración de las aplicaciones y en la organización de Soft-Skill Trainings. La calificación exigida es una maestría o titulo equivalente.Se buscarán candidatas y candidatos quienes demuestren una gran interés hacia la interdisciplinariedad. Para garantizar el reconocimiento de las calificaciones, el Cluster brindará asistencia en las disciplinas especificas de las y los doctorantes. Por lo general el trabajo de promoción tiene una duración de tres años.El programa de promoción doctoral del Cluster ofrece un programa de formación que ofrece competencias disciplinarias claves relevantes para la formación científica. En el marco de las Áreas de Investigación se organizarán coloquios en los cuales se presentarán los proyectos de disertación. El programa de estudio consta de 30 créditos, se organizará de manera individual y en relación a la propuesta de disertación. Un punto central es la adquisición de competencias interdisciplinarias. Como actividades obligatorias esta previstas la organización de simposios o workshops, así como la realización de clases.",,,,,,,promotionsprogramm-bild-wissen-gestaltung,,,"Promotionsprogramm »Bild Wissen Gestaltung«","Doctoral program »Image Knowledge Gestaltung«","Programa de promoción Bild Wissen Gestaltung",/home/promotionsprogramm-bild-wissen-gestaltung/,,,,,,,,1,"https://humboldt-graduate-school.de/de/aktuelles/herzlich-willkommen https://humboldt-graduate-school.de/de/aktuelles/herzlich-willkommen https://humboldt-graduate-school.de/en/aktuelles-en/welcome?set_language=en http://humboldt-graduate-school.de/ https://humboldt-graduate-school.de/de/aktuelles/herzlich-willkommen https://humboldt-graduate-school.de/de/aktuelles/herzlich-willkommen https://humboldt-graduate-school.de/en/aktuelles-en/welcome?set_language=en http://humboldt-graduate-school.de/"
1382,2016-07-04,"Chancengleichheit ist ein notwendiges Anliegen auch für den Cluster. Hierzu zählt insbesondere die Karriereförderung der Wissenschaftlerinnen aller Statusgruppen, wie etwa in Maßnahmen der Individualförderung, Karriere- und Konfliktberatung.Besonders spürbar wird die gläserne Decke (die unsichtbare Hürde, an der nicht-privilegierte Gruppen scheitern bzw. ausscheiden) in den höheren Statusgruppen im akademischen Mittelbau, also in der Gruppe der Postdoktorandinnen auf dem Weg in Leitungsfunktionen. Zugleich gibt es zwar spätestens seit der Exzellenzinitiative eine Fülle an Förderangeboten für Promovierende, doch mangelt es bundesweit und an der HU ausgerechnet an Förderungen für die Phase nach der Promotion und insbesondere an incentives für die Postdoktorandinnen. Der Cluster richtet daher seine besondere Aufmerksamkeit auf die weiblichen Mitglieder dieser Statusgruppe im Angebot von Postdoktorandinnen-Seminaren.Die wissenschaftliche Mitarbeiterin für Diversity in der Geschäftsstelle kooperiert mit den Zuständigen für Diversity der Berliner Exzellenzcluster Topoi (Freie Universität) und Unicat (Technische Universität). Gemeinsam werden Bedarfsabfragen für Fortbildungsseminare durchgeführt und die auf die Ergebnisse ausgerichteten Seminare angeboten, vom Präsentationsprofiling über Drittmitteleinwerbung zu Berufscoaching.Durch die Kooperation der Diversity Zuständigen der Berliner Exzellenzcluster werden einerseits die Exzellenzmittel effektiv gebündelt und zugleich profitieren Postdoktorandinnen von der  Vernetzungsmöglichkeit in Berlin.",888,f,[],"Chancengleichheit ist ein notwendiges Anliegen auch für den Cluster. Hierzu zählt insbesondere die Karriereförderung der Wissenschaftlerinnen aller Statusgruppen, wie etwa in Maßnahmen der Individualförderung, Karriere- und Konfliktberatung.Besonders spürbar wird die gläserne Decke (die unsichtbare Hürde, an der nicht-privilegierte Gruppen scheitern bzw. ausscheiden) in den höheren Statusgruppen im akademischen Mittelbau, also in der Gruppe der Postdoktorandinnen auf dem Weg in Leitungsfunktionen. Zugleich gibt es zwar spätestens seit der Exzellenzinitiative eine Fülle an Förderangeboten für Promovierende, doch mangelt es bundesweit und an der HU ausgerechnet an Förderungen für die Phase nach der Promotion und insbesondere an incentives für die Postdoktorandinnen. Der Cluster richtet daher seine besondere Aufmerksamkeit auf die weiblichen Mitglieder dieser Statusgruppe im Angebot von Postdoktorandinnen-Seminaren.Die wissenschaftliche Mitarbeiterin für Diversity in der Geschäftsstelle kooperiert mit den Zuständigen für Diversity der Berliner Exzellenzcluster Topoi (Freie Universität) und Unicat (Technische Universität). Gemeinsam werden Bedarfsabfragen für Fortbildungsseminare durchgeführt und die auf die Ergebnisse ausgerichteten Seminare angeboten, vom Präsentationsprofiling über Drittmitteleinwerbung zu Berufscoaching.Durch die Kooperation der Diversity Zuständigen der Berliner Exzellenzcluster werden einerseits die Exzellenzmittel effektiv gebündelt und zugleich profitieren Postdoktorandinnen von der  Vernetzungsmöglichkeit in Berlin.",,,,,,,,,karriereentwicklung-fur-postdoktorandinnen,,,"Karriereentwicklung für Postdoktorandinnen",,,/home/karriereentwicklung-fur-postdoktorandinnen/,,,,,,,,1,
1830,2016-07-14,"Im Zuge der Schwerpunktsetzung am Interdisziplinären Labor Bild Wissen Gestaltung wurden für jeden Schwerpunkt Postdoc-Schwerpunktleitungen benannt, die zusammen mit den jeweiligen Principal Investigators (PIs) den jeweiligen Schwerpunkt leiten. Die Schwerpunktleitungen haben folgende zentrale Aufgaben:Innovationsperspektiven zu entwickeln, indem neue Gegenstände und Themenfelder zur Fragestellung erarbeitet werden,eine Bestandsaufnahme der Forschungen und Forschungsergebnisse zum Schwerpunkt im Cluster zu ermöglichen,die Fokussierung und Synthese der Forschungsleistungen und Themenfelder zu befördern,die Einwerbung von Drittmitteln, komplementär zur Clusterforschung (vor und nach 2017), anzuschieben undspezifische Förderkriterien für die Auswahl von Forschungsprojekten für ihren Schwerpunkt zu formulieren.",,f,[],"Im Zuge der Schwerpunktsetzung am Interdisziplinären Labor Bild Wissen Gestaltung wurden für jeden Schwerpunkt Postdoc-Schwerpunktleitungen benannt, die zusammen mit den jeweiligen Principal Investigators (PIs) den jeweiligen Schwerpunkt leiten. Die Schwerpunktleitungen haben folgende zentrale Aufgaben:Innovationsperspektiven zu entwickeln, indem neue Gegenstände und Themenfelder zur Fragestellung erarbeitet werden,eine Bestandsaufnahme der Forschungen und Forschungsergebnisse zum Schwerpunkt im Cluster zu ermöglichen,die Fokussierung und Synthese der Forschungsleistungen und Themenfelder zu befördern,die Einwerbung von Drittmitteln, komplementär zur Clusterforschung (vor und nach 2017), anzuschieben undspezifische Förderkriterien für die Auswahl von Forschungsprojekten für ihren Schwerpunkt zu formulieren.",,,,,,,,,postdoc-schwerpunktleitungen,,,Postdoc-Schwerpunktleitungen,,,/home/postdoc-schwerpunktleitungen/,,,,,,,,1,
108,2016-04-26,"Die Themenklasse besteht seit 2014 jährlich aus circa 15 Studierenden verschiedener Disziplinen, die im Interdisziplinären Labor, fachlich betreut durch wissenschaftliche Mitarbeitende, eigene Forschungsprojekte umsetzen. Dies wird ermöglicht durch ein Deutschlandstipendium, unterstützt von der Schering Stiftung. Im Sinne des forschenden Lernens bearbeiten die Studierenden eigenständig Themen und tragen so zum Forschungsfeld von »Bild Wissen Gestaltung« bei. Regelmäßig stattfindende Treffen und Workshops bieten darüber hinaus einen Rahmen für Austausch und Vernetzung.Die Themenklasse 2016 setzt sich aus Studierenden der Disziplinen Kunst- und Bildgeschichte, Biologie, Kulturwissenschaft, Genderstudies, Psychologie und Philosophie zusammen. Die Stipendiat_innen sind in den vier Schwerpunkten »Active Matter«, »Architekturen des Wissens«, »Formprozess &#38; Modellierung« sowie »Bild &#38; Handlung« aktiv.Koordiniert wird die Themenklasse von Franziska Wegener und Katrina Schulz.AKTUELL: Launch der Themenklassen-Publikation »beobachten – entwerfen – verbinden«Im Rahmen der Langen Nacht der Wissenschaft 2016 wurde der Sammelband  »beobachten – entwerfen – verbinden« der Deutschlandstipendium-Themenklasse 2015 gelauncht. Die Publikation vereint in konzisen Beiträgen die Projekte der elf Stipendiat_innen verschiedener Disziplinen, die im letzten Jahr eigene Forschungsprojekte im Interdisziplinären Labor umgesetzt haben. Sammelband »beobachten – entwerfen – verbinden. Themenklasse Bild Wissen Gestaltung 2015«.",124,f,"[{\&quot;type\&quot;: \&quot;image_carousel\&quot;, \&quot;value\&quot;: [{\&quot;image\&quot;: 951}, {\&quot;image\&quot;: 955}, {\&quot;image\&quot;: 953}, {\&quot;image\&quot;: 956}, {\&quot;image\&quot;: 127}, {\&quot;image\&quot;: 125}, {\&quot;image\&quot;: 126}, {\&quot;image\&quot;: 954}, {\&quot;image\&quot;: 952}, {\&quot;image\&quot;: 123}]}]","Die Themenklasse besteht seit 2014 jährlich aus circa 15 Studierenden verschiedener Disziplinen, die im Interdisziplinären Labor, fachlich betreut durch wissenschaftliche Mitarbeitende, eigene Forschungsprojekte umsetzen. Dies wird ermöglicht durch ein Deutschlandstipendium, unterstützt von der Schering Stiftung. Im Sinne des forschenden Lernens bearbeiten die Studierenden eigenständig Themen und tragen so zum Forschungsfeld von »Bild Wissen Gestaltung« bei. Regelmäßig stattfindende Treffen und Workshops bieten darüber hinaus einen Rahmen für Austausch und Vernetzung.Die Themenklasse 2016 setzt sich aus Studierenden der Disziplinen Kunst- und Bildgeschichte, Biologie, Kulturwissenschaft, Genderstudies, Psychologie und Philosophie zusammen. Die Stipendiat_innen sind in den vier Schwerpunkten »Active Matter«, »Architekturen des Wissens«, »Formprozess &#38; Modellierung« sowie »Bild &#38; Handlung« aktiv.Koordiniert wird die Themenklasse von Franziska Wegener und Katrina Schulz.AKTUELL: Launch der Themenklassen-Publikation »beobachten – entwerfen – verbinden«Im Rahmen der Langen Nacht der Wissenschaft 2016 wurde der Sammelband  »beobachten – entwerfen – verbinden« der Deutschlandstipendium-Themenklasse 2015 gelauncht. Die Publikation vereint in konzisen Beiträgen die Projekte der elf Stipendiat_innen verschiedener Disziplinen, die im letzten Jahr eigene Forschungsprojekte im Interdisziplinären Labor umgesetzt haben. Sammelband »beobachten – entwerfen – verbinden. Themenklasse Bild Wissen Gestaltung 2015«.",,,,,,,,,themenklasse-bild-wissen-gestaltung,,,"Themenklasse »Bild Wissen Gestaltung«",,,/home/themenklasse-bild-wissen-gestaltung/,,,,,,,118,1,
