page_ptr_id,date,body,main_image_id,featured,image_carousel,body_de,body_en,body_es,search_description_de,search_description_en,search_description_es,seo_title_de,seo_title_en,seo_title_es,slug_de,slug_en,slug_es,title_de,title_en,title_es,url_path_de,url_path_en,url_path_es,main_image_caption,main_image_caption_de,main_image_caption_en,main_image_caption_es,gefoerdert_durch_img_id,active,urls
1831,2016-07-14,"Am Interdisziplinären Labor wurden seit 2012 insgesamt 31 Stellen für Postdocs geschaffen und besetzt. Aktuelle Ausschreibungen werden unter dem Menüpunkt Jobs veröffentlicht. ",,f,[],"Am Interdisziplinären Labor wurden seit 2012 insgesamt 31 Stellen für Postdocs geschaffen und besetzt. Aktuelle Ausschreibungen werden unter dem Menüpunkt Jobs veröffentlicht. ",,,,,,,,,stellenausschreibungen-fur-postdocs,,,"Stellenausschreibungen für Postdocs",,,/home/stellenausschreibungen-fur-postdocs/,,,,,,,,1,
1666,2013-04-11,"Das Interdisziplinäre Labor »Bild Wissen Gestaltung« führte vom 15. bis zum 18. Juli Jahr 2013  erstmalig eine interdisziplinäre Sommeruniversität für Kinder durch. Die Sommer-universität ermöglichte Kindern im Alter von ca. 10 bis ca. 15 Jahren einen Einblick in die verschiedenen Forschungsbereiche des Clusters und damit einen Blick hinter die Kulissen von Wissenschaft und Forschung. Zielgruppe waren vorrangig Kinder von Mitarbeitenden der Humboldt-Universität zu Berlin. Programm: Montag, 15. Juli 20138–12 Uhr »Wie wird ein Labor gestaltet?«Anhand einer visuellen Reise durch die Geschichte der Labore werden die Kinder mit verschiedenen Labortypen vertraut gemacht. Bei einem Ratespiel können die Kinder Postkarten mit Labordarstellungen auf einem Zeitstrahl anordnen und bekommen so auf spielerische Art und Weise einen Einblick in die Veränderung von Wissensarchitektur. Schließlich wird ein gemeinsames Experiment durchgeführt und mit Stickstoff Speiseeis hergestellt. 12–13 Uhr Mittagspause und gemeinsames Mittagessen 13–17 Uhr »Psychologe_in für einen Tag«Was ist ein psychologisches Experiment? Am Beispiel der Wahrnehmungspsychologie wird erkundet, was Psychologen_innen in der Wissenschaft untersuchen.Ort: Campus Adlershof Dienstag, 16. Juli 20139–12 Uhr»Spieleentwickler_in für einen Tag« Aus einem wilden Durcheinander von Materialien werden nach einer Konzeptphase gemeinsam Spiele entwickelt. Der Gestaltungsfreiheit sind keine Grenzen gesetzt, aber nach drei Stunden sollte es ein Ergebnis geben: Ein Spiel, das mehrere Kinder spielen können. 12–13 Uhr Mittagspause und gemeinsames Mittagessen 13–17.10 Uhr »Ein Nachmittag hinter den Kulissen des Museums für Kommunikation«Der Besuch des Depots des Museums für Kommunikationn bringt Einsicht in Exponate: was wird gesammelt, welche Stücke kommen in eine Ausstellung, wie werden sie konserviert und welche Perspektive bietet die europäische Ethnologie auf Artefakte des Wissens und der Kommunikation?Ort: Sophienstr. 22a, 2. HH, 2. Etage, 10178 Berlin, Zentrallabor &#38; Depot des Museums für Kommunikation Berlin, Ringbahnstr. 130, 12103 Berlin Mittwoch, 17. Juli 20139–12 Uhr »Modellbauer_in für einen Tag«Das Sommeruni-Puzzle: Wie es bei einem Design-Projekt üblich ist, werden Entwürfe erst gezeichnet, dann von Hand Modelle gebaut und zum Schluss die Entwürfe mit dem Laserschneider produziert. Außerdem wird gezeigt, wie die computergesteuerten Maschinen Lasercutter und 3D-Drucker funktionieren. 12–13 Uhr Mittagspause und gemeinsames Mittagessen 13–16 Uhr »Modellbauer_in für einen Tag« Teil 2 Fortsetzung der Gestaltung eigener Entwürfe, s. o. Ort: Sophienstr. 22a, 2. HH, 3. Etage, 10178 Berlin, Werkstatt Donnerstag, 18. Juli 20139–12 Uhr »Soundexperte_in für einen Tag« In diesem Workshop werden wir eine Chladni-Klangbox bauen, mit der sich Klang sichtbar machen lässt. Eindrucksvoll kann erlebt werden, wie die aus einem Lautsprecher dringenden Töne eine mit feinem Gries bestreute Oberfläche in Schwingung versetzen, und so je nach Frequenz immer neue Klangbilder entstehen. 12–13 Uhr Mittagspause und gemeinsames Mittagessen 13–17 Uhr »Biologe/in für einen Tag« – zusammen mit dem Museum für NaturkundeZusammen mit einem Museumspädagogen wird das Naturschutzgebiet um die Karower Teiche und die dort fließende Panke erkundet. Mit Becherlupe, Sieb und Fotoschale werden Pflanzenbestände und Gewässergrund auf Kleinlebewesen wie Insektenlarven, Würmer und Kleinkrebse untersucht. Je nach Jahres- und Tageszeit sind auch Vogelbeobachtungen an den Karower Teichen möglich (Bitte Ferngläser mitbringen!).Ort: Sophienstr. 22a, 2. HH, 2. Etage, 10178 Berlin, Zentrallabor",525,f,"[{\&quot;value\&quot;: [{\&quot;image\&quot;: 528}, {\&quot;image\&quot;: 527}, {\image\&quot;: 526}","{\&quot;image\&quot;: 525}","{\&quot;image\&quot;: 524}","{\&quot;image\&quot;: 523}","{\&quot;image\&quot;: 522}","{\&quot;image\&quot;: 521}","{\&quot;image\&quot;: 520}","{\&quot;image\&quot;: 519}","{\&quot;image\&quot;: 518}","{\&quot;image\&quot;: 517}]",type-image_carousel,"Das Interdisziplinäre Labor »Bild Wissen Gestaltung« führte vom 15. bis zum 18. Juli Jahr 2013  erstmalig eine interdisziplinäre Sommeruniversität für Kinder durch. Die Sommer-universität ermöglichte Kindern im Alter von ca. 10 bis ca. 15 Jahren einen Einblick in die verschiedenen Forschungsbereiche des Clusters und damit einen Blick hinter die Kulissen von Wissenschaft und Forschung. Zielgruppe waren vorrangig Kinder von Mitarbeitenden der Humboldt-Universität zu Berlin. Programm: Montag, 15. Juli 20138–12 Uhr »Wie wird ein Labor gestaltet?«Anhand einer visuellen Reise durch die Geschichte der Labore werden die Kinder mit verschiedenen Labortypen vertraut gemacht. Bei einem Ratespiel können die Kinder Postkarten mit Labordarstellungen auf einem Zeitstrahl anordnen und bekommen so auf spielerische Art und Weise einen Einblick in die Veränderung von Wissensarchitektur. Schließlich wird ein gemeinsames Experiment durchgeführt und mit Stickstoff Speiseeis hergestellt. 12–13 Uhr Mittagspause und gemeinsames Mittagessen 13–17 Uhr »Psychologe_in für einen Tag«Was ist ein psychologisches Experiment? Am Beispiel der Wahrnehmungspsychologie wird erkundet, was Psychologen_innen in der Wissenschaft untersuchen.Ort: Campus Adlershof Dienstag, 16. Juli 20139–12 Uhr»Spieleentwickler_in für einen Tag« Aus einem wilden Durcheinander von Materialien werden nach einer Konzeptphase gemeinsam Spiele entwickelt. Der Gestaltungsfreiheit sind keine Grenzen gesetzt, aber nach drei Stunden sollte es ein Ergebnis geben: Ein Spiel, das mehrere Kinder spielen können. 12–13 Uhr Mittagspause und gemeinsames Mittagessen 13–17.10 Uhr »Ein Nachmittag hinter den Kulissen des Museums für Kommunikation«Der Besuch des Depots des Museums für Kommunikationn bringt Einsicht in Exponate: was wird gesammelt, welche Stücke kommen in eine Ausstellung, wie werden sie konserviert und welche Perspektive bietet die europäische Ethnologie auf Artefakte des Wissens und der Kommunikation?Ort: Sophienstr. 22a, 2. HH, 2. Etage, 10178 Berlin, Zentrallabor &#38; Depot des Museums für Kommunikation Berlin, Ringbahnstr. 130, 12103 Berlin Mittwoch, 17. Juli 20139–12 Uhr »Modellbauer_in für einen Tag«Das Sommeruni-Puzzle: Wie es bei einem Design-Projekt üblich ist, werden Entwürfe erst gezeichnet, dann von Hand Modelle gebaut und zum Schluss die Entwürfe mit dem Laserschneider produziert. Außerdem wird gezeigt, wie die computergesteuerten Maschinen Lasercutter und 3D-Drucker funktionieren. 12–13 Uhr Mittagspause und gemeinsames Mittagessen 13–16 Uhr »Modellbauer_in für einen Tag« Teil 2 Fortsetzung der Gestaltung eigener Entwürfe, s. o. Ort: Sophienstr. 22a, 2. HH, 3. Etage, 10178 Berlin, Werkstatt Donnerstag, 18. Juli 20139–12 Uhr »Soundexperte_in für einen Tag« In diesem Workshop werden wir eine Chladni-Klangbox bauen, mit der sich Klang sichtbar machen lässt. Eindrucksvoll kann erlebt werden, wie die aus einem Lautsprecher dringenden Töne eine mit feinem Gries bestreute Oberfläche in Schwingung versetzen, und so je nach Frequenz immer neue Klangbilder entstehen. 12–13 Uhr Mittagspause und gemeinsames Mittagessen 13–17 Uhr »Biologe/in für einen Tag« – zusammen mit dem Museum für NaturkundeZusammen mit einem Museumspädagogen wird das Naturschutzgebiet um die Karower Teiche und die dort fließende Panke erkundet. Mit Becherlupe, Sieb und Fotoschale werden Pflanzenbestände und Gewässergrund auf Kleinlebewesen wie Insektenlarven, Würmer und Kleinkrebse untersucht. Je nach Jahres- und Tageszeit sind auch Vogelbeobachtungen an den Karower Teichen möglich (Bitte Ferngläser mitbringen!).Ort: Sophienstr. 22a, 2. HH, 2. Etage, 10178 Berlin, Zentrallabor",,,,,,,,,interdisziplinare-sommeruniversitat-fur-kinder-15-bis-18-juli-2013_2,,,interdisziplin%c3%a4re-sommeruniversit%c3%a4t-f%c3%bcr-kinder-2013,,t,
142,2016-01-01,"Das Interdisziplinäres Labor lud vom 15. bis zum 21. September 2013 zur KOSMOS Summer University »Modern Walking. Innovative Urban Mobility« ein. In Zusammenarbeit mit Experten aus São Paulo (Universidade de São Paulo) und Bogotá (Universidad Nacional de Colombia) wurde nach experimentellen Lösungen für Mobilität im urbanen Raum gesucht. Nachdem das Auto im 21. Jahrhundert mehr und mehr an seine technischen Grenzen zu gelangen scheint, gilt es nunmehr da Zufußgehen als innovative Form der Fortbewegung wie des Transports zu analysieren und als Modell für die Zukunft zu entwickeln.Ziel der Summer University war es, interdisziplinäre Problemlösungsstrategien für aktuelle und zukünftige Mobilitätsfragen zu entwickeln. Die vier Schwerpunktthemen wurden von Professor_innen und Postgraduate-Studierenden aus Geistes- und Naturwissenschaften mit Gestalter_innen, Planungs- und Verkehrsexpert_innen bearbeitet. Der intensiven Arbeitsphase in Berlin ging eine gemeinsame Materialsammlung und wissenschaftlicher Austausch auf einer Online-Plattform voraus, die auch die Nachbereitung und Weiterführung der Projekte unterstützt. Die Herausforderungen der gemeinsamen Forschung in dieser höchst diversen Fächerkonstellation erweiterte darüber hinaus die interkulturellen und interdisziplinären Kompetenzen der Beteiligten und bot die Chance das Format der Summer University für interkulturelle und interdisziplinäre Problemlösungsstrategien zu schärfen.Schwerpunktthemen:Walking &#38; Orientation Wie orientieren wir uns in der Stadt? Welche Zeichen könnten einen symbiotischen Verkehr von Menschen und Autos gleichermaßen steuern?Walking &#38; Acoustics Städtisches Leben und urbane Bewegung prägende Parameter wie Rhythmus, Puls oder Tempo kann man mithilfe des auditiven Zugangs tatsächlich erfassen.Walking &#38; Wisdom of Crowds Untersucht wurden Mechanismen der Schwarmintelligenz. Wie verhalten sich große Gruppen, wie bewegen sich individuelle Fußgänger im diffusen Gedränge in unterschiedlichen Richtungen und verschiedenen Geschwindigkeiten?Walking &#38; Interaction Gehen ist eine vielfältige Operation, bei der sich Orientierung, Beobachtung der unmittelbaren Umgebung (bis zu Sightseeing) und auch andere Verrichtungen, insbesondere seit es mobile Techniken wie Smartphones gibt, mit der eigentlichen Fortbewegung verbinden.Einen Einblick in die Zusammenarbeit mit den Expert_innen aus São Paulo (Universidade de São Paulo) und Bogotá (Universidad Nacional de Colombia) während der Summer University bietet ein kurzer Film, der den interkulturellen und interdisziplinären Austausch dokumentiert. ",621,f,"[{\&quot;type\&quot;: \&quot;image_carousel\&quot;, \&quot;value\&quot;: [{\&quot;image\&quot;: 622}, {\&quot;image\&quot;: 623}, {\&quot;image\&quot;: 624}, {\&quot;image\&quot;: 625}, {\&quot;image\&quot;: 627}, {\&quot;image\&quot;: 628}]}]","Das Interdisziplinäres Labor lud vom 15. bis zum 21. September 2013 zur KOSMOS Summer University »Modern Walking. Innovative Urban Mobility« ein. In Zusammenarbeit mit Experten aus São Paulo (Universidade de São Paulo) und Bogotá (Universidad Nacional de Colombia) wurde nach experimentellen Lösungen für Mobilität im urbanen Raum gesucht. Nachdem das Auto im 21. Jahrhundert mehr und mehr an seine technischen Grenzen zu gelangen scheint, gilt es nunmehr da Zufußgehen als innovative Form der Fortbewegung wie des Transports zu analysieren und als Modell für die Zukunft zu entwickeln.Ziel der Summer University war es, interdisziplinäre Problemlösungsstrategien für aktuelle und zukünftige Mobilitätsfragen zu entwickeln. Die vier Schwerpunktthemen wurden von Professor_innen und Postgraduate-Studierenden aus Geistes- und Naturwissenschaften mit Gestalter_innen, Planungs- und Verkehrsexpert_innen bearbeitet. Der intensiven Arbeitsphase in Berlin ging eine gemeinsame Materialsammlung und wissenschaftlicher Austausch auf einer Online-Plattform voraus, die auch die Nachbereitung und Weiterführung der Projekte unterstützt. Die Herausforderungen der gemeinsamen Forschung in dieser höchst diversen Fächerkonstellation erweiterte darüber hinaus die interkulturellen und interdisziplinären Kompetenzen der Beteiligten und bot die Chance das Format der Summer University für interkulturelle und interdisziplinäre Problemlösungsstrategien zu schärfen.Schwerpunktthemen:Walking &#38; Orientation Wie orientieren wir uns in der Stadt? Welche Zeichen könnten einen symbiotischen Verkehr von Menschen und Autos gleichermaßen steuern?Walking &#38; Acoustics Städtisches Leben und urbane Bewegung prägende Parameter wie Rhythmus, Puls oder Tempo kann man mithilfe des auditiven Zugangs tatsächlich erfassen.Walking &#38; Wisdom of Crowds Untersucht wurden Mechanismen der Schwarmintelligenz. Wie verhalten sich große Gruppen, wie bewegen sich individuelle Fußgänger im diffusen Gedränge in unterschiedlichen Richtungen und verschiedenen Geschwindigkeiten?Walking &#38; Interaction Gehen ist eine vielfältige Operation, bei der sich Orientierung, Beobachtung der unmittelbaren Umgebung (bis zu Sightseeing) und auch andere Verrichtungen, insbesondere seit es mobile Techniken wie Smartphones gibt, mit der eigentlichen Fortbewegung verbinden.Einen Einblick in die Zusammenarbeit mit den Expert_innen aus São Paulo (Universidade de São Paulo) und Bogotá (Universidad Nacional de Colombia) während der Summer University bietet ein kurzer Film, der den interkulturellen und interdisziplinären Austausch dokumentiert. ","The Interdisciplinary Laboratory invited to the KOSMOS Summer University »Modern Walking – Innovative Urban Mobility« which took place from 15 to 21,September 2013. Together with experts from Sao Paulo (Universidade de Sao Paulo) and Bogotá (Universidad Nacional de Colombia), researchers gathered to develop and discuss new forms of mobility in urban space within the concept of walking as an efficient, energy saving and sustainable model of transport.The purpose of this Summer University was to develop interdisciplinary problem-solving strategies for current and future mobility problems. Professors and post-graduate students from humanities and natural science will worked on four key topics together with designers and transport experts.Key topicsWalking &#38; Orientation How do we orientate ourselves in the city? Which signs could serve for people and automobiles simultaneously? Interpretation also depends on the cultural background and especially in Latin America, where analphabetism is still an issue, semiotic and oral orientation systems have a distinctively high relevance.Walking &#38; Acoustics Urban life and movements are influenced by parameters like rhythm, pace and pulse, which can actually be recorded. Under this hybrid understanding of the city it is possible to design patterns of movement as acoustic processes.Walking &#38; Wisdom of Crowds How do crowds behave? Do individuals move differently when being in a crowd, including different directions and velocities? How do they avoid collision? Heterogenous masses densify, slow down, jam and dissolve again into single elements at metro stations, crossings and narrow passes, getting into buses or trains. How do pedestrians interact with other mobile but non-human actors? What kind of collisions are welcome, and which ones are to be avoided in a crowd?Walking &#38; Interaction Walking is a very complex operation in which pedestrians nowadays combine the observation of the immediate environment with the use of mobile technology, like smartphones, to interact and determine movement. How do these diverse activities are further stimulated through walking? How much interaction can be brought in without becoming dangerous? Talking on the phone, writing e-mails or sms, talking within a group, how to avoid collision?A short film gives an insight to the collaboration with experts from Sao Paulo (Universidade de Sao Paulo) and Bogotá (Universidad Nacional de Colombia) during the KOSMOS Summer University and documents the intercultural and interdisciplinary exchange. ","El Laboratorio Interdisciplinario realizo del 15 al 21 de septiembre del 2013 la KOSMOS Summer University »Modern Walking. Innovative Urban Mobility« durante la cual expertos de Sao Paulo (Universidade de Sao Paulo), Bogotá (Universidad Nacional de Bogotá) y Berlin (Humboldt-Universität zu Berlin) desarrollaron y discutieron nuevas formas de movilidad en el espacio urbano, enfocándose en el caminar como modelo de transporte eficiente y sustentable.El objetivo de esta Summer University consistió en desarrollar estrategias para solucionar los problemas que la movilidad presente y futura genera. Cuatro temas centrales fueron tratados por profesores y estudiantes de posgrado de las humanidades y ciencias naturales, conjuntamente con diseñadores y expertos en trafico y urbanismo. La intensiva fase de trabajo en Berlín estuvo precedida por la plataforma online iversity, la cual permitio el intercambio de materiales y conocimientos entre los 34 participantes.Temas centralesWalking &#38; Orientation ¿Cómo nos orientamos en una ciudad? ¿Qué clase de señalización funciona tanto para las personas como para los automóviles?Walking &#38; Acoustics Los movimientos y la vida en general en los centros urbanos están influenciados por parámetros como ritmo, velocidad y pulso. Bajo este análisis de la ciudad, es posible diseñar patrones de movimiento como procesos acústicos.Walking &#38; Wisdom of Crowds ¿Cómo se comportan las multitudes? ¿En una multitud, cuáles son las colisiones que pueden ser positivas y cuáles deben ser evitadas?Walking &#38; Interaction Actualmente el caminar es una operación bastante compleja, en la cual el peatón combina la observación de su entorno con el uso de tecnología móvil, como los Smartphone. ¿En que medida estas actividades son estimuladas al caminar?Los experimentos y resultados fueron exhibidos el 21 de septiembre en el Laboratorio Interdisciplinario en la Sophienstr. 22, Berlín. ",,,,,,,kosmos-summer-university-2013-modern-walking-innovative-urban-mobility,,,"KOSMOS Summer University 2013 »Modern Walking. Innovative Urban Mobility«","KOSMOS Summer University 2013 »Modern Walking. Innovative Urban Mobility«","KOSMOS Summer University »Modern Walking. Innovative Urban Mobility«",/home/kosmos-summer-university-2013-modern-walking-innovative-urban-mobility/,,,,,,,,,
